<?xml version="1.0"?>
<xs:schema xmlns:xs="http://www.w3.org/2001/XMLSchema">
    <xs:attribute name="name" type="xs:string"/>
    <xs:element name="shop">
        <xs:complexType>
            <xs:sequence>
                <xs:element ref="category" maxOccurs="unbounded"/>
            </xs:sequence>
        </xs:complexType>
    </xs:element>
    <xs:element name="category">
        <xs:complexType>
            <xs:sequence>
                <xs:element ref="subcategory" maxOccurs="unbounded"/>
            </xs:sequence>
            <xs:attribute ref="name" use="required"/>
        </xs:complexType>
    </xs:element>
    <xs:element name="subcategory">
        <xs:complexType>
            <xs:sequence>
                <xs:element ref="product" maxOccurs="unbounded"/>
            </xs:sequence>
            <xs:attribute ref="name" use="required"/>
        </xs:complexType>
    </xs:element>
    <xs:element name="product">
        <xs:complexType>
            <xs:sequence>
                <xs:element name="manufacturer" type="xs:string"/>
                <xs:element name="model">
                    <xs:simpleType>
                        <xs:restriction base="xs:string">
                            <xs:pattern value="[a-zA-Z]{2}[0-9]{3}"/>
                        </xs:restriction>
                    </xs:simpleType>
                </xs:element>
                <xs:element name="dateOfManufacture">
                    <xs:simpleType>
                        <xs:restriction base="xs:string">
                            <xs:pattern value="[0-9]{2}-[0-9]{2}-[0-9]{4}"/>
                        </xs:restriction>
                    </xs:simpleType>
                </xs:element>
                <xs:element name="color" type="xs:string"/>
                <xs:element name="price" type="xs:float"/>
                <xs:element name="quantity" type="xs:int"/>
            </xs:sequence>
        </xs:complexType>
    </xs:element>
</xs:schema>